### ISSUE TITLE
Local Proxy: display aborted requests

### ISSUE THREAD

**Issue by ge0rg** [zaproxy/zaproxy#7187]
### Is your feature request related to a problem? Please describe.

When doing TLS MitM with the local proxy, a client that doesn't accept ZAP's served certificate will abort the connection, sometimes with an SSL-level error message sent to ZAP. Knowing about these failed requests is of tremendous help in debugging the setup / in verifying correct client-side TLS verification.

OTOH, it often happens that you do not realize that these connections are happening (because both the client and ZAP are silent), and look all over the place for the cause of why it's just not 🤬 working.

### Describe the solution you'd like

It would be great to have some visibility into these aborted proxy requests, showing the attempted hostname:port as well as the client-side SSL error if available, e.g. in the History tab (or, as some other well-known proxy solution does it, aggregated under "Alerts"), like this:

```
| Source | Method  | URL                     | Code | Reason                   |
| Proxy  | CONNECT | some.important.host:443 | n/a  | Alert: Fatal, Unknown CA |
```

As this might get _slightly_ verbose, it would probably make sense to have a filter for these messages, e.g. an option "[ ] Show aborted requests" in the Local Proxies settings, or using the History tab's filter to hide Method:CONNECT.

### Describe alternatives you've considered

The alternative is to have wireshark or tcpdump running in parallel to see the requests, but this is even more noisy and less informative, and needs to be thought of by the proxy user.

This is an expanded example from wireshark:
```
Internet Protocol Version 4, Src: 192.168.0.100, Dst: 192.168.0.11
Transmission Control Protocol, Src Port: 54929 (54929), Dst Port: http-alt (8080), Seq: 411, Ack: 3089, Len: 7
Hypertext Transfer Protocol
    [Proxy-Connect-Hostname: some.important.host]
    [Proxy-Connect-Port: 443]
Transport Layer Security
    TLSv1.2 Record Layer: Alert (Level: Fatal, Description: Unknown CA)
        Content Type: Alert (21)
        Version: TLS 1.2 (0x0303)
        Length: 2
        Alert Message
            Level: Fatal (2)
            Description: Unknown CA (48)
```

### Would you like to help fix this issue?

- [ ] Yes

**Comment by thc202** [comment]
You can already see the CONNECT requests in the History tab, not that if the following handshake was un/successful though at leat not explicitly, either a new request is sent or not.

https://www.zaproxy.org/docs/desktop/ui/dialogs/options/view/#show-local-connect-requests

**Comment by ge0rg** [comment]
Ah, thanks. I missed that (would it be possible to duplicate it in the "Local Proxy" tab?).

It would be really great to add the TLS alerts into this display / or to have a flag to only show errored-out connections (I understand that from a pure transparent proxy view it is not clear when the wrapped connection terminated in error, if there is no explicit TLS error).
